status_id,status_message,link_name,status_type,status_link,status_published,num_likes,num_comments,num_shares
124462251040725_433295120355121,"b'Final release is now on sale!! Get your tickets here: http://boogiewonderland.getqpay.com \n\nFrom the team who brought you Daddy\xe2\x80\x99s Yacht Party, Neverland Ball and SUBS\xc2\xb7CHELLA: \n\n***\n\nIt\xe2\x80\x99s time to say goodbye to Daddy\xe2\x80\x99s Limousine and hello to Austin Powers meets Dancing Queen. \nDon\xe2\x80\x99t let those mid-semesters throw you off the boat, P\xe2\x80\x99s get degrees so it\xe2\x80\x99s time to float. \nBeer, booze, buzz and all, bring your biggest hooped earrings, and we\xe2\x80\x99ll supply the disco ball.\nIt\xe2\x80\x99s time to get groovy so take my hand, and get your tickets to SUBS Cruise Boogie Wonderland. \n\nRe-ignite your creative juices that accounting has suppressed! Flaunt those flared pants, tease that fro, release the chest hair and come get groooooovy baby. \n\nThink Jackson 5, I will survive, Elvis is King and Charlie Angels in bright bling. \n\nSkip your vegan, gluten, sugar, fat and taste free brunch and come get a shot of some real vitamin sea. Because who needs a kale smoothie when the only shake you\xe2\x80\x99ll be doing is with your booty. \n\nPut on some Go Go boots, grease up your hair, rediscover your mojo and get into the 70s flair. \n\nIt\xe2\x80\x99s a free spirited cruise with unlimited booze.\nAnd if you miss out on a ticket, don\xe2\x80\x99t blame it on the sunshine, don\xe2\x80\x99t blame it on the moonlight, don\xe2\x80\x99t blame it on subsmarine, blame it on the boogie. \n\n*************************************************************\n\nDate: 10th of May - Wednesday Night, Week 9 \n\nTime: Meet 6:30pm at Cargo Bar for a 7pm Departure from King Street Wharf. \n\nTicket Release: \nEARLY BIRD - THIS Friday 14th April, 10am - SOLD OUT\nFIRST RELEASE - Tuesday 18th April, 9am - SOLD OUT \nSECOND RELEASE - Wednesday 26th April 9am - SOLD OUT\n\nPrice: \nEarly Bird - Access $39, Non-Access $45 + bf - SOLD OUT \nGeneral Release - Access $44, Non-Access $50 +bf - SOLD OUT\n\nTicket Includes:\n- Boat entry\n- UNLIMITED alcohol (beer, wine, champagne) for the first three hours on board \n- UNLIMITED pizza (meat and vegetable) \n- UNLIMITED tunes and grooves\n- Entry to official after party \n\nOFFICIAL AFTERS: Cargo Bar - $5 drinks all night long\n\nLots of Love,\nSUBS \n\nThis is a 18+ ONLY event. SUBS supports the responsible service of alcohol.\nUnfortunately we offer no ticket refunds. \n*************************************************************\nStay up to date and like SUBS:\nFacebook Page: Sydney University Business Society (SUBS)\nFacebook Group: https://www.facebook.com/groups/1749145088651287/\nInstagram: subsoc\nSnapchat: subsoc'",b'SUBS x Midori present: Boogie Wonderland Cruise - SOLD OUT',event,https://www.facebook.com/events/433295120355121/,2017-04-12 05:37:11,9,3,0
124462251040725_828281920658751,"b""Don't forget to swing by ABS 1060 for some free pizza and good times in 10 mins !!!!""",b'SUBS Weekly Meetups',event,https://www.facebook.com/events/317916728627035/,2017-04-11 20:48:10,2,1,0
124462251040725_284346125343138,"b'SUBS wants to welcome you all with open arms to our weekly meetups\n\n12-3 every Wednesday \n\nWe want YOU to make the most out of your uni life so if you come along to our weekly meetups, we guarantee the following awesome opportunities to:\n\n\xe2\x80\xa2\tGet more involved with SUBS\n\xe2\x80\xa2\tMeet the exec team\n\xe2\x80\xa2\tFree drinks\n\xe2\x80\xa2\tFree food\n\xe2\x80\xa2\tFree friends**\n\xe2\x80\xa2\tSweet chills and hangs\n\xe2\x80\xa2\tGood vibes\n\n** Subject to mutual agreement.\n\nMore info and details to come weekly!'",b'SUBS Weekly Meetups',event,https://www.facebook.com/events/284346125343138/,2017-04-11 07:03:21,1,0,0
124462251040725_317916728627035,"b'SUBS wants to welcome you all with open arms to our weekly meetups\n\n12-1 every Wednesday \n\nWe want YOU to make the most out of your uni life so if you come along to our weekly meetups, we guarantee the following awesome opportunities to:\n\n\xe2\x80\xa2\tGet more involved with SUBS\n\xe2\x80\xa2\tMeet the exec team\n\xe2\x80\xa2\tFree drinks\n\xe2\x80\xa2\tFree food\n\xe2\x80\xa2\tFree friends**\n\xe2\x80\xa2\tSweet chills and hangs\n\xe2\x80\xa2\tGood vibes\n\n** Subject to mutual agreement.\n\nMore info and details to come weekly!'",b'SUBS Weekly Meetups',event,https://www.facebook.com/events/317916728627035/,2017-04-11 07:02:18,2,0,0
124462251040725_827874787366131,"b'SUBS brought the festival of lace, flower crowns and round shades to our very own backyard with SUBS\xc2\xb7chella - our first ever All Years Camp.'",b'SUBS Presents: SUBS\xc2\xb7chella - All Years Camp',photo,https://www.facebook.com/SydneyUniversityBusinessSociety/photos/a.827871907366419.1073741858.124462251040725/827874787366131/?type=3,2017-04-11 05:37:45,63,0,0
124462251040725_445517659117205,"b""The competition you have been waiting for is finally here.\n\nSUBS Presents: Uber Launch Challenge - University of Sydney.\n\nREGISTRATIONS ARE NOW OPEN: t.uber.com/launchchallenge\n\n\xe2\x9d\x82 \xe2\x9d\x82 \xe2\x9d\x82 \n\nUber launched in San Francisco in 2010. Today, they've helped over 2 billion people reach their destination in 450+ cities around the world.\n\nThe Uber Launch Challenge invites all University of Sydney students in teams of 2-3 to pitch an expansion strategy for real-life Uber products, as Uber continues to evolve the way cities move.\n\nThe winning team from each Campus Heat will receive an all expense paid trip to our Australian Regional Headquarters in Sydney and the opportunity to pitch to the Uber Leadership Team.\n\n---------------------------\n\nKEY DATES (subject to change):\n10 April - Registrations Open: t.uber.com/launchchallenge\n28 April - Registrations Close\n1 May - Challenge Released \n4 May - Pitching and Presenting Workshop\n7 May -  Submissions Due\n12 May - USYD Campus Finals + Networking Event\n22 May - Sydney Finalist Presentations\n\nTHE CHALLENGE:\nThe Uber Launch Challenge 2017 theme is \xe2\x80\x98Shared Rides\xe2\x80\x99\n\nFrom Sydney to S\xc3\xa3o Paulo, we\xe2\x80\x99ve been working hard to get to know our cities, with the goal of making them safer, smarter, more accessible and less congested. Our bold experiments in shared rides technology are making this mission a reality, with products including uberPOOL, uberHOP and uberCOMMUTE.\n\nThe Challenge places you on the frontline as we launch these products in new markets. Teams will be given the opportunity to:\n- Analyse demand and supply levers, turning raw data into actionable insights; \n- Define a launch strategy and incentive scheme to encourage early adoption and rapid growth of both driver-partners and riders; \n- Build a business model, optimising Uber\xe2\x80\x99s core metrics to ensure operational excellence at scale.\n\nTHE PRIZES:\nThe Campus Heat winners will receive an all expense paid trip to Sydney to compete in the Finals on 20th May. The top three teams will be awarded up to $1,500 in Uber rides or UberEATS credits, and the first place team will earn guaranteed interviews for the 2018 Uber Graduate Program.\n\nThe Challenge is open to students at all universities across Australia and New Zealand, with Campus Heats taking place at the following universities: University of Sydney, University of New South Wales, University of Melbourne, University of Queensland, University of Adelaide, Australian National University, University of Western Australia, and University of Auckland.\n\nWant to be part of the Uber Launch Challenge but can't find a team to join? \nFill out this form and we'll find a team for you!\nhttps://goo.gl/forms/c1j6FCnb99gqqs5s1\n\nUber Launch Challenge\nhttps://www.facebook.com/uberlaunchchallenge/\n---------------------------""",b'Uber Launch Challenge - University of Sydney',event,https://www.facebook.com/events/445517659117205/,2017-04-10 05:16:00,1,0,0
124462251040725_825805437573066,"b""Applications for SUBS subcommittee close TOMORROW NIGHT!! Apply today if you haven't already, as who isn't keen to be a part of the largest and most active faculty society on campus?\n\nThe role of SUBS is simple; we\xe2\x80\x99re here to make sure you get the most out of your time studying at the Business School and leave with absolutely no regrets! We do this by acting as the bridge between students, the University and the workforce.\n\nWhether it be our highly anticipated social events and parties or our career-orientated networking events, our aim is to enrich the university experience of our student members.\n\nApply today! https://www.cognitoforms.com/SydneyUni/SUBSSubcommitteeApplicationForm\n\nWe\xe2\x80\x99re looking for subcommittee across the following portfolios:\n- Events\n- Marketing (Design)\n- Marketing (Social Media)\n- Sports\n- External Relations\n- Operations\n- International Student Relations\n- Alumni Relations\n- Treasury \n\nSo click attending, invite your mates and get applying!""",b'SUBS Presents: Subcommittee Applications!',event,https://www.facebook.com/events/1881594282120647/,2017-04-07 21:53:37,12,0,0
124462251040725_825785954241681,"b'BCG Australia and New Zealand is proud to announce the official launch of their 2017 Scholarship Campaign! Do not miss this opportunity to apply for one of two AUD $15,000 scholarships, and to potentially secure a graduate position!\n\nInterested to learn more? Visit bit.ly/BCGScholarshipProgram'",b'Timeline Photos',photo,https://www.facebook.com/SydneyUniversityBusinessSociety/photos/a.166658686821081.1073741825.124462251040725/825785954241681/?type=3,2017-04-07 21:11:58,3,0,0
124462251040725_823819751104968,"b'Are you an aspiring consultant? Sydney Consulting Club is calling for all students in final, penultimate or pre-pen year to attend their networking event in April - Consultants on Campus Getting Coffee!\n\nFacebook Event: facebook.com/events/288532341576294/\nApplication Form: https://form.jotform.co/70917933793873\n\nApplications are assessed on a rolling basis and close 9am, 10 April. Successful applicants will be notified by 10 April night. Join firms like: McKinsey, Bain, Oliver Wyman, A.T. Kearney, Strategy&, EY and more!'",b'Consultants on Campus Getting Coffee',event,https://www.facebook.com/events/288532341576294/,2017-04-05 04:34:49,5,0,0
124462251040725_1881594282120647,"b'Are you keen to be a part of the largest and most active faculty society on campus?\n\nThe role of SUBS is simple; we\xe2\x80\x99re here to make sure you get the most out of your time studying at the Business School and leave with absolutely no regrets! We do this by acting as the bridge between students, the University and the workforce.\n\nWhether it be our highly anticipated social events and parties or our career-orientated networking events, our aim is to enrich the university experience of our student members.\n \nIf you love what SUBS is about and have a heart full of passion, WE WANT YOU. \n\nApplications to join the SUBS Subcommittee ARE NOW OPEN  and will close at 11:59pm Sunday 9th. \n\nApply today! https://www.cognitoforms.com/SydneyUni/SUBSSubcommitteeApplicationForm\n\nWe\xe2\x80\x99re looking for subcommittee across the following portfolios:\n- Events\n- Marketing (Design)\n- Marketing (Social Media)\n- Sports\n- External Relations\n- Operations\n- International Student Relations\n- Alumni Relations\n- Treasury \n\nSo click attending, invite your mates and get applying!'",b'SUBS Presents: Subcommittee Applications!',event,https://www.facebook.com/events/1881594282120647/,2017-04-04 05:30:06,2,0,0
124462251040725_822952304525046,"b""It's time for your Career Health Check!\n\nA quick visit to the careers clinic will enhance your resume, career plans, job applications and make sure you're on track for a healthy career future!\n\nRegister now: sydney.edu.au/business/careers/events""",b'Timeline Photos',photo,https://www.facebook.com/SydneyUniversityBusinessSociety/photos/a.166658686821081.1073741825.124462251040725/822952304525046/?type=3,2017-04-03 19:32:01,3,0,0
124462251040725_822658037887806,"b'The Boston Consulting Group (BCG) is proud to announce the official launch of their 2017 Scholarship Campaign! Do not miss this opportunity to apply for one of two AUD 15,000 scholarships, and to potentially secure a graduate position! \n\nInterested to learn more? Visit bit.ly/BCGScholarshipProgram'",b'Timeline Photos',photo,https://www.facebook.com/SydneyUniversityBusinessSociety/photos/a.166658686821081.1073741825.124462251040725/822658037887806/?type=3,2017-04-03 08:54:16,5,0,0
124462251040725_822034247950185,"b'With a jam-packed week ahead, make sure to note these dates in your diary and swing by! SUBS will be delivering all kinds of goods from case competitions to careers fairs, to networking and free donuts on campus!\n\nMonday April 3rd \xe2\x80\x93 EY Case Competition Campus Heats (5-7.30pm at Refectory)\nWatch the Top 8 USYD teams compete for the final 2 spots to be crowned as the Campus finalists for the EY x SUBS Case competition!\n\nTuesday April 4th \xe2\x80\x93 2017 Careers Fair (3-6pm at the Darlington Centre, just past Merewether)\nA great chance for (but not limited to) penultimate/final year students to network with sponsors and have a chat about upcoming internship/graduate opportunities!\nhttps://tinyurl.com/SUBSCareersFair\n\nWednesday April 5th \xe2\x80\x93 SUBS x Spoonfeedme FREE donut giveaway (1-3pm at Cadigal Green)\nFree KK donuts, enough said. Courtesy of SUBS and our friends at Spoonfeedme!\nhttps://tinyurl.com/spoonfeedmedonuts\n\nThursday April 6th \xe2\x80\x93 Google On-Campus (4-6pm at Institute Building)\nGet the inside scoop on what a day a Google looks like and hear about the exciting internship and graduate opportunities within their Business / Non-Technical teams!\ntinyurl.com/GoogleOnCampusUSYD\n\nHave a great week!'",b'Timeline Photos',photo,https://www.facebook.com/SydneyUniversityBusinessSociety/photos/a.166658686821081.1073741825.124462251040725/822034247950185/?type=3,2017-04-02 05:23:53,12,0,6
124462251040725_820196938133916,"b""YOU'RE INVITED! \n\nJoin BCG at their Women@BCG event for female students. Hear stories, ask questions & network with the women of BCG. \n\nRegister by Friday 21 April via http://on.bcg.com/2nNe5Em""",b'Timeline Photos',photo,https://www.facebook.com/SydneyUniversityBusinessSociety/photos/a.166658686821081.1073741825.124462251040725/820196938133916/?type=3,2017-03-30 01:50:40,2,0,0
124462251040725_820038224816454,"b""Have you always wanted to get your voice out there and heard in the industry? Ever wanted to stand out as a thinker and a leader, and explore business issues related to your own interests? Well here's your chance!\n\nInside Enterprise are seeking both WRITERS and EDITORS for Issue 8: 'Breakthrough'. No previous experience is needed, and students from all years and degrees are encouraged to apply. \n\nThis is an opportunity too good to miss \xe2\x80\x93 apply now: https://tinyurl.com/IEWritersApp""","b'Inside Enterprise Issue 8 ""Breakthrough"": Writer Applications'",event,https://www.facebook.com/events/1878079285804088/,2017-03-29 17:15:46,2,0,0
124462251040725_819248274895449,"b'LAST CHANCE! \nApplications for the BCG Strategy Academy close this Thursday!  \n\nThis is your opportunity to learn from BCG Consultants and work on your analytical, communication and leadership skills through a series of in-class, hands-on activities and case studies.\n\n Interested? Apply at bit.ly/BCGStrategyAcademySYD'",b'Timeline Photos',photo,https://www.facebook.com/SydneyUniversityBusinessSociety/photos/a.166658686821081.1073741825.124462251040725/819248274895449/?type=3,2017-03-28 05:42:05,6,0,0
124462251040725_819187284901548,"b""FREE PIZZA TOMORROW!!! ABS CS lecture threatre 1070 1-2 pm\n\nLooking to set yourself apart this year? \n\nMicrosoft Prot\xc3\xa9g\xc3\xa9 is your opportunity to play a role and have an impact in challenging traditional business processes, and solve real business problems. Prot\xc3\xa9g\xc3\xa9 is highly valued within the company \xe2\x80\x93 finalists not only win prizes, but have direct access to mentoring, career opportunities within the company and exposure to the Australian Senior Leadership Team. Winners receive the Ultimate Microsoft Experience and have lunch with the Managing Director of Microsoft Australia. \n\nThis year, the focus of Microsoft Prot\xc3\xa9g\xc3\xa9 is Digital Transformation. We want you to take on the role of a digital consultant! Analyse how the digital shift is changing Australian industries, and form a strategy on how to reinvent how commercial businesses operate and deliver value to their customers. \n\nRun by Microsoft, this workshop is your opportunity to ask questions, clarify any aspects of the case study, and learn more about what we are looking for. The workshop will cover:\n- What is Prot\xc3\xa9g\xc3\xa9? \n- The Power of Story Telling \n- Logical reasoning in Case Competition, delivered by BusinessOne Consulting \n- What Microsoft is looking for and best practices for Presentations (including Structure, Submission Process) \n- Previous Prot\xc3\xa9g\xc3\xa9 Winners sharing their personal experience \n- Open Q&A discussion \n\nWe highly recommend attending this workshop if you are looking to set yourself up in the competition. And if that's not enough to convince you to come, there will also be PIZZA! For more information, please visit: https://www.microsoft.com/en-au/protege/""",b'Microsoft Prot\xc3\xa9g\xc3\xa9',link,https://www.microsoft.com/en-au/protege/,2017-03-28 03:04:15,5,1,0
124462251040725_402945620066144,"b""Do you have a sweet tooth? Do you freaking love donuts but never have the dough? \n\nDONUT WORRY WE ARE HANDING OUT DELICIOUS WHEELS OF GOODNESS FOR FREE!! Creds to our amazing sponsor spoonfeedme, we are here to spoon feed you! For freeee! So come channel your inner Homer Simpson, stereotypical fat cop or hungry and budget-stricken uni student by joining us at Cadigal Lawns (behind Scitech library) Wednesday 5th April from 1pm. \n\nKripsy Kremes will be flying left, right and centre so invite your mates and come get your hands finger lickin' sticky! \xe2\x99\xa5 \n\nspoonfeedme: https://spoonfeedme.com.au \n\nFacebook Group: https://www.facebook.com/groups/1749145088651287/\nSUBS Snapchat: subsoc\nSUBS Insta: subsoc""",b'SUBS x spoonfeedme: free donuts',event,https://www.facebook.com/events/402945620066144/,2017-03-27 03:02:55,8,0,0
124462251040725_818548068298803,"b""Don't miss out on this incredible opportunity to study overseas. Applications for the program close tonight!""",b'United States Studies Centre',link,http://bit.ly/UCLAStudyAbroad,2017-03-26 22:57:15,4,0,0
124462251040725_1884594681752788,"b'Google is coming to the University of Sydney!\n\nGet the inside scoop on what a day a Google looks like and hear about the exciting internship and graduate opportunities within their Business / Non-Technical teams!\n\nThere\xe2\x80\x99ll also be a Q&A + Prizes + Pizzas with Googlers! \n\nRegister here to attend:\nhttps://events.withgoogle.com/google-on-campus-anz-non-tech/\n\nWe encourage all Business-related Students in their penultimate and final years to attend.\n\nEvent details:\nWhen: Thursday 6th April, 4:00pm - 6:00pm\nWhere: Institute Lecture Theatre 1, The Institute Building\n\nSee you there!\n\nThis event is brought to you by the Careers & Employability Office at the University of Sydney. Stay up-to-date with their events by joining their Facebook group: https://www.facebook.com/groups/ceosydney/'",b'Google On-Campus!',event,https://www.facebook.com/events/1884594681752788/,2017-03-26 17:55:25,15,0,0
124462251040725_814773895342887,"b'There has never been a more exciting time to be an aspiring management consultant.\n\nBack by popular demand, our friends at the WOSOC (Work and Organisational Studies Society) will be holding a Q&A panel of Management Consultant Professionals from Grant Thornton, PwC, EY, Corteks and the Customer Experience Company and more. This will be followed by a short networking session with the representatives of their companies.\n\nRegister now: https://goo.gl/forms/i3mNz9sMlaXKNK7m2 \n\nEvent Info:\nhttps://www.facebook.com/events/1852070398339906/'",b'Timeline Photos',photo,https://www.facebook.com/SydneyUniversityBusinessSociety/photos/a.166658686821081.1073741825.124462251040725/814773895342887/?type=3,2017-03-20 04:06:53,10,0,0
124462251040725_1336892826377189,"b""Looking to set yourself apart this year? \n\nMicrosoft Prot\xc3\xa9g\xc3\xa9 is your opportunity to play a role and have an impact in challenging traditional business processes, and solve real business problems. Prot\xc3\xa9g\xc3\xa9 is highly valued within the company \xe2\x80\x93 finalists not only win prizes, but have direct access to mentoring, career opportunities within the company and exposure to the Australian Senior Leadership Team. Winners receive the Ultimate Microsoft Experience and have lunch with the Managing Director of Microsoft Australia. \n\nThis year, the focus of Microsoft Prot\xc3\xa9g\xc3\xa9 is Digital Transformation. We want you to take on the role of a digital consultant! Analyse how the digital shift is changing Australian industries, and form a strategy on how to reinvent how commercial businesses operate and deliver value to their customers. \n\nRun by Microsoft, this workshop is your opportunity to ask questions, clarify any aspects of the case study, and learn more about what we are looking for. The workshop will cover:\n-\tWhat is Prot\xc3\xa9g\xc3\xa9? \n-\tThe Power of Story Telling \n-\tLogical reasoning in Case Competition, delivered by BusinessOne Consulting \n-\tWhat Microsoft is looking for and best practices for Presentations (including Structure, Submission Process) \n-\tPrevious Prot\xc3\xa9g\xc3\xa9 Winners sharing their personal experience \n-\tOpen Q&A discussion \n\nWe highly recommend attending this workshop if you are looking to set yourself up in the competition. And if that's not enough to convince you to come, there will also be PIZZA! For more information, please visit: https://www.microsoft.com/en-au/protege/""",b'Microsoft Prot\xc3\xa9g\xc3\xa9 Workshop',event,https://www.facebook.com/events/1336892826377189/,2017-03-20 02:21:51,6,0,0
124462251040725_814622532024690,"b""Join the next Postgraduate Business information session for career and program advice from professors, current students and admissions.\n\nDon't miss out on the keynote presented by Hugh Harley, Financial Services leader PwC, on 'Tomorrow's demands on Business'.\n\nREGISTER HERE: http://sydney.edu.au/business/events/2017/student/postgraduate_business_information_session_march23\n\nEvent details:\nWhere: University of Sydney Business School CBD Campus, 133 Castlereagh St, Sydney.\nWhen: 5-7pm | Thursday 23 March""",b'Timeline Photos',photo,https://www.facebook.com/SydneyUniversityBusinessSociety/photos/a.166658686821081.1073741825.124462251040725/814622532024690/?type=3,2017-03-19 20:57:02,4,0,0
124462251040725_814017195418557,"b""Registrations for the SUBS + UNSW Business School x EY: Case Competition close today at midnight!! Make sure to sign up here https://goo.gl/forms/bud94pes9eRW4LC32 to secure your team's chance to take on an EY case and win the prize of $1500 and mentoring.\n\nWe are lucky to have Dr Zina O'Leary with us to head the post submission workshop on Wednesday evening, the 29th of March. All case competition teams with a submission will be invited to attend, with teams proceeding to campus heats to be announced at the conclusion of the workshop. Catering will be provided.\n\nEvent page: http://tinyurl.com/SUBSUNSWEYCaseComp""",b'Timeline Photos',photo,https://www.facebook.com/SydneyUniversityBusinessSociety/photos/a.166658686821081.1073741825.124462251040725/814017195418557/?type=3,2017-03-18 20:26:53,10,0,0
124462251040725_813002175520059,"b""Wanting to meet some fellow business students, looking to get more involved in uni life or just love playing sport?\n\nNext week kicks off a new year of the Inter-faculty Sports Championship, in which the university's faculties go head to head in a different sport every Wednesday. Join our SUBS SPORTS Facebook group to stay up to date with the details of the weekly events, and score yourself a free Business Society shirt and a Red Bull (courtesy of their sponsorship) if you participate!\n\nhttps://www.facebook.com/groups/615190841974461/""",,status,,2017-03-17 02:30:15,9,0,0
124462251040725_812478942239049,"b'Are you unsure of what finance is about and what career path it may take you to? Do you want to learn more about the financial industry and what it takes to get there?\n\nIf so, UNIT\xe2\x80\x99s Finance 101 event is the perfect opportunity for you! Hear from Terri Dang and Kartik Shastri, USYD students who have had internship experiences at major finance firms. \n\nNO registrations needed for entry, just click Going to be reminded of the event date. Entry is completely free. Catering will be provided.'",b'Finance 101 l UNIT Sydney',event,https://www.facebook.com/events/1498004390251374/,2017-03-16 21:26:05,14,0,0
124462251040725_812475228906087,"b'EY are looking for students who are invested in building a better working world. Applications are open for various student opportunities. Find out which program is right for you and apply today!\n\nFor more information on how and where to apply, visit http://www.ey.com/au/betterbeginsnow'",b'EY Australia Career opportunities',link,http://www.ey.com/au/betterbeginsnow,2017-03-15 23:59:42,13,0,0
