status_id,status_message,link_name,status_type,status_link,status_published,num_likes,num_comments,num_shares
124462251040725_1620772661506060,"b'Hi all,\n\nApplications for the 2015 Deloitte Development Program close in just a few days on Wednesday 2nd September.\n\nThe exclusive Deloitte Development Program is a two-day interactive program, offering you professional development and an insight into life at Deloitte.  This is an opportunity for you learn more about the firm and your role to apply for a summer vacation position.  \n\nIf you are an undergraduate student in your first year of a three year degree, second year of a four year degree or third year of a five year degree, you are eligible to apply.\n \nThe Deloitte Development Program will provide you with the opportunity to:\n\xc2\xb7         Learn about Deloitte and our career opportunities\n\xc2\xb7         Experience the life of a Deloittian\n\xc2\xb7         Sharpen your business etiquette and networking skills\n\xc2\xb7         Receive coaching on applications and interview skills\n\n\nThe program is a 2 day interactive program where students will gain their first insight into life at Deloitte and professional development.\n\nPlease visit http://yourfuture.deloitte.com.au/ for further information on how to apply.'",b'2015 Deloitte Development Program',event,https://www.facebook.com/events/1620772661506060/,2015-08-30 03:50:59,2,0,0
124462251040725_994901143865232,"b'We are proud to announce the first ever Sydney University Business School Societies Combined High Achievers Breakfast. SUBS, SMS, WOSOC, AAASoc and Beta Alpha Psi have collaborated to celebrate the academic success of the Business School\xe2\x80\x99s high achieving students.\n \nThis breakfast will provide exclusive networking opportunities with Australia\xe2\x80\x99s top employers and fellow Associate Deans.\n \nOur keynote speaker, Lee White, CEO of Chartered Accountants Australia and New Zealand (CAANZ), will be sharing invaluable insights into his own career path, challenges he faced and advice on how to take advantage of opportunities.\n \nThis is not an opportunity to be missed if you are serious about your future employment opportunities. Places are strictly limited, so get your applications in quick!\n\nApplications are now open at http://bit.ly/1NWg79i and close on the 9th of September at 11:59pm.\n \nPenultimate and final year students with Distinction WAM are preferred applicants, however students from all years are welcome to apply.\n \nDate: Tuesday, 15th September\nTime: 8am -10am\nVenue: The Darlington Centre, 174 City Rd, Darlington, NSW 2008\nCost: Free\nDress: Strictly Business Attire\n \nIf you have any questions, please email events@subsoc.com.au with your name and year.\n \nWe look forward to seeing you there!'",b'The Sydney University Business School Societies Present: The High Achievers Breakfast',event,https://www.facebook.com/events/994901143865232/,2015-08-27 06:29:14,3,0,0
124462251040725_540916626061950,"b""#SUBSPORT So we hear that the winning team of this this week's Interfaculty Sport dominated the other faculties, with each and every serve and spike, a heavy reminder to the opponents that the best USYD faculty is and always will be, business!!\n\nCongratulations to everyone who came and played for SUBS today. We look forward to seeing as many of you at Interfac Rock Climbing next Wednesday! \n\nP.S. Anyone and everyone is welcome to play at Interfac, so whether you just want to try out a sport or flex your skills, all is welcome :) Also, for those who come to rep Business in Interfac Sport, SUBS is brewing up something good for you... so watch this space!""",b'Timeline Photos',photo,https://www.facebook.com/SydneyUniversityBusinessSociety/photos/a.166658686821081.1073741825.124462251040725/540916626061950/?type=3,2015-08-26 03:09:21,41,3,1
124462251040725_154959048174955,"b'What can you serve but never eat?\n\nA Volleyball\n\nCalling all you volleyballers or just anyone that wants to play.\n\nINTERFAC VOLLEYBALL is on this week! Come over to SUSAC Courts this Wednesday and support the Business school.\n\nAll levels of experience are encouraged to participate, just bring a black t-shirt with you. REPRESENT.\n\nHope to see you there!\n\nIf you have any questions shoot an email to \n\nsports@subsoc.com.au'",b'SUBS Interfaculty Volleyball',event,https://www.facebook.com/events/154959048174955/,2015-08-25 07:00:46,1,0,0
124462251040725_540210749465871,"b'CALLING ALL COMMERCE STUDENTS!\n\nThe time is now to get excited for Commerce Revue: Guys and Dollar Bills!!! Try your luck with our cast of notoriously talented gangsters, gamblers and groovers for a night of song, dance and sketch comedy.\n\nGrab your friends and come along to this spectacular event! Complete with our live band, we\xe2\x80\x99re betting that you\xe2\x80\x99ll have a great night. \n\nThe show opens THIS THURSDAY NIGHT at the Seymour Centre, running from the 27-29th of August!! So be quick and get your tickets now: from the stall outside Manning 11am-3pm Tuesday and Wednesday; online; or at the door! You don\xe2\x80\x99t want to miss out!\n\nAre you ready for the big time? With odds like these, you can\xe2\x80\x99t lose.\n\n\nRecommended for audiences 15 years and above. This show contains coarse language, adult themes, nudity, haze, smoke and allusions to smoking. Viewer discretion advised. \nhttps://www.facebook.com/events/1000249940019155/ \n\n-----\n\nIf that\xe2\x80\x99s not enough to entice you, watch the promo vid:\nhttps://www.youtube.com/watch?v=6CZN_625BTo'",b'Commerce Revue 2015 Presents: GUYS AND DOLLAR BILLS',event,https://www.facebook.com/events/1000249940019155/,2015-08-24 02:32:57,1,0,0
124462251040725_537437859743160,"b'Congratulations to the 2015/16 executive!!\n\nThe returning officer Joshua Sprake has announced the following provisional results:\n\nPresident: Monica Caruana\nVice-President: Chris Lam\nSecretary: Robyn Lu\nTreasurer: Claire Ho\nEvents Directors: Roy N\xc3\xa9ill, Sachin Bhat, Anthony Maka\nExternal Relations Director: Josh Ferris\nMarketing Director (Social Media): Georgiana Ma\nMarketing Director (Design): Vanessa Au-Yeung\nPublications Directors: Sophie Masterton, Kartik Shastri, David Hogan\nSports Directors: Uphaar Mehta, Emma Wiltshire\nIT Directors: Kevin Gatdula, Vishal Uppal\nAlumni Relations Director: Dean Bartolotta\nFirst year representative: Ada Yin\n\nShould no dispute be lodged with the returning officer within 48 hours to secretary@subsoc.com.au these results will be declared officially. If a dispute is lodged then the results will be declared after any and all disputes are resolved.'",,status,,2015-08-17 07:51:15,11,1,0
124462251040725_537293769757569,"b""ATTN: Deloitte's Cyber Risk Services team and the Graduate Recruitment team will be hosting a mock assessment centre for penultimate and final year university students on the 27th of August!""","b""Photos from Sydney University Business Society - SUBS's post""",photo,https://www.facebook.com/SydneyUniversityBusinessSociety/photos/a.166658686821081.1073741825.124462251040725/537293676424245/?type=3,2015-08-16 18:17:16,1,0,0
124462251040725_537064373113842,b'Nominations have officially closed for our AGM!!\n\nWe look forward to seeing you all tomorrow at 1800 at the Isabelle Fidler room in Manning House!!\n\nJoshua James Sprake is to be the Returning Officer on the night so if you have any questions about the election or the AGM more generally please contact him at secretary@subsoc.com.au.',b'SUBS Annual General Meeting',event,https://www.facebook.com/events/111492085864359/,2015-08-16 03:02:47,5,0,0
124462251040725_536981916455421,"b'A reminder that our AGM will be taking place tomorrow night, with the following positions being open for nomination:\n\ni) 1 President\nii) 1 Vice President\niii) 1 Secretary\niv) 1 Treasurer \nv) 3 Events Directors\nvi) 1 External Relations Director\nvii) 1 Marketing Director (Social Media)\nviii) 1 Marketing Director (Design)\nix) 3 Publications Directors\nx) 2 Sports Directors\nxi) 2 IT Directors\nxii) 1 Alumni Relations Director\n\nPlease submit your nominations no later than 6PM TONIGHT!\n\nSee you there - https://www.facebook.com/events/111492085864359/'",b'SUBS Annual General Meeting',event,https://www.facebook.com/events/111492085864359/,2015-08-15 22:28:44,1,0,0
124462251040725_536570733163206,"b""Happy Weekend Everyone!!\n\nNominations for the SUBS 2015/16 Executive close tomorrow at 1800 AEST!!\n\nMake sure your nominations are in before 1800 as our returning officer Joshua James Sprake is not appreciative of any tardiness!!\n\nYou can't win it unless you're in it!!""",b'Sydney University Business Society - SUBS',link,https://www.facebook.com/SydneyUniversityBusinessSociety/posts/528418557311757,2015-08-14 20:30:03,0,0,0
124462251040725_536342686519344,"b""Don't forget to apply to the Woolworths Summer Internship Program! \n\nStudents are being offered the chance to work on some great projects across Business Leadership, IT, Big Data and Logistics that will provide the successful candidates with some meaningful work experience over the summer break. Successful candidates will be offered a fast-tracked recruitment process for the following year's Graduate Program.  \n\nApplications close on the 23rd of August. Hurry and don't miss out on this fantastic opportunity!""",b'Timeline Photos',photo,https://www.facebook.com/SydneyUniversityBusinessSociety/photos/a.166658686821081.1073741825.124462251040725/536342686519344/?type=3,2015-08-14 02:44:47,2,1,1
124462251040725_536669109820035,"b'Battle to Battle, Shot after Shot, Tag yourself and your comrades for the highlights of the fun.'",b'SUBS Back to Sem',photo,https://www.facebook.com/SydneyUniversityBusinessSociety/photos/a.536657859821160.1073741844.124462251040725/536668669820079/?type=3,2015-08-15 04:41:30,42,2,2
124462251040725_535284236625189,"b'Attention all undergrads! Next Monday the 17th of August marks the start of Get Prepared Week which kicks off with an Undergraduate Majors Information Session. \n\nThe Careers and Employability Office will also be holding a series of Industry Visits from KPMG, Optus, and Marsh. Places are limited so please register by emailing your preferences to business.careersrsvp@sydney.edu.au.'",b'Timeline Photos',photo,https://www.facebook.com/SydneyUniversityBusinessSociety/photos/a.166658686821081.1073741825.124462251040725/535284236625189/?type=3,2015-08-11 17:53:55,5,0,0
124462251040725_534812556672357,"b""2 days to go!! \n\nDon't forget to buy your tickets to the Back to Semester Party!!\n\nWe are going to have a jungle of a time! Rally the Troops and get ready for battle!""",b'SUBS Presents: Back to Semester Party',event,https://www.facebook.com/events/577867412352829/,2015-08-11 08:00:47,2,0,0
124462251040725_533998376753775,"b""ATTN: SUBSTERS. It\xe2\x80\x99s the team at Clemenger Sydney and we\xe2\x80\x99ve tapped into your Facebook. If you have a curious mind and you\xe2\x80\x99re keen to get it ticking as part of the 2016 Clemenger Group Graduate Program, at Australia's largest and most-awarded advertising and communications network, remember that applications for the program are closing September 4!\n\nApply here: http://clemengergroup.com.au/#url=graduates/australian-graduates\n\nWe know that there\xe2\x80\x99s never too much information if it\xe2\x80\x99s application-relation information, so we\xe2\x80\x99ve organised a Workshop night. Direct your retinas in this direction (http://curiousbbdo.com.au/) for more information, or join us on Facebook (https://www.facebook.com/clemengergraduateprogram)""",b'Timeline Photos',photo,https://www.facebook.com/SydneyUniversityBusinessSociety/photos/a.166658686821081.1073741825.124462251040725/533998376753775/?type=3,2015-08-09 19:43:23,3,0,0
124462251040725_533510313469248,b'Hey Everyone!!\n\nNominations for the SUBS 2015/16 Executive close soon. Please see the below post for further information.\n\nWe encourage you to nominate for as many positions as you wish so we have the best possible team for 2015/16!!\n\nOur loyal secretary waits with bated breath for your nominations!!',b'Sydney University Business Society - SUBS',link,https://www.facebook.com/SydneyUniversityBusinessSociety/posts/528418557311757,2015-08-09 06:50:35,1,0,0
124462251040725_532496080237338,"b'Hey Everyone,\n\nNext Monday we will be holding a stall outside the Merewether Building. It will run from 9am-4pm and we will be selling tickets to our BACK TO SEMESTER PARTY and will be selling and giving out already purchased SYDNEY BUSINESS hoodies and sweaters. \n\nWe cant wait to see you there!\n\nhttps://www.facebook.com/events/577867412352829/'",b'SUBS Presents: Back to Semester Party',event,https://www.facebook.com/events/577867412352829/,2015-08-06 23:46:19,8,0,0
124462251040725_531079677045645,"b""Accenture is a leading global management consulting firm. Don't miss out on a fantastic opportunity to network with representatives from across the business as well as HR to boost your application chances! Digital is the future and Accenture is at the crux of its intersection with business.""",b'SUBS x FMAA Presents: Accenture BBQ',event,https://www.facebook.com/events/786106578168627/,2015-08-03 01:50:07,0,0,0
124462251040725_786106578168627,"b""SUBS and FMAA are pleased to announce that Accenture representatives and HR will be out on campus this Tuesday to answer all your questions! \n\nAccenture is a global management consulting, technology services and outsourcing company helping clients in Australia become high-performing organisations. \n\nApplications for both their graduate program and coveted Accenture Adventure are open and in full force! \n\nAccenture is looking for students who are keen to start their career in Management or Technology Consulting, across a range of different industry groups including banking, insurance, healthcare, mining, retail, communications, media and government agencies.\n \nAccenture Adventure is a one day event that will take place in October where you will come together with likeminded students. You will get the opportunity to work together, with Accenture experts, to showcase your innovative thinking, can-do attitude, team spirit and leadership skills. The day will end with outstanding students being identified and subsequently offered a role within our 2017 Accenture Graduate program.\n\nDon't miss out a on fantastic opportunity to network with representatives from across the firm. This is not limited to just Business students. Engineering and Science students are welcome to attend.""",b'SUBS x FMAA Presents: Accenture BBQ',event,https://www.facebook.com/events/786106578168627/,2015-07-31 20:18:40,1,0,0
124462251040725_111492085864359,"b'Notice is hereby given for the 2015 Sydney University Business School AGM to be held on the 17/8/2015 at 1800 AEST at the Isabel Fidler Room, Level 2, Manning House.\n\nThe agenda for the Annual General Meeting shall include:\n\n1. Opening and welcome\n2. Apologies and leaves of absence\n3. Minutes of the previous meeting\n4. Business arising from the minutes\n5. Correspondence\n6. Motions on notice\n7. Annual Reports\n7.1 President\n7.2 Treasurer\n7.3 Secretary\n7.4 Other Executive Members\n8. Election of the Executive\n9. General business\n\nPlease also consider this notice for the election of all positions aside for the first year representative as per the constitution. Nominations are officially open and will close on the 16.8.15 at 1800 AEST sharp. No nominations will be accepted after this time.\n\nThe positions available are:\ni) 1 President\nii) 1 Vice President\niii) 1 Secretary\niv) 1 Treasurer \nv) 3 Events Directors\nvi) 1 External Relations Director\nvii) 1 Marketing Director (Social Media)\nviii) 1 Marketing Director (Design)\nix) 3 Publications Directors\nx) 2 Sports Directors\nxi) 2 IT Directors\nxii) 1 Alumni Relations Director\n\nAll nominees are invited to submit a short paragraph to be read on their behalf if they are unable to attend the meeting in person. As per the constitution any person nominating for the position of President, Vice President, Secretary and Treasurer must submit a written nomination. \n\nThe president must also have previously served on a business school affiliated society executive. Please ensure this is included in your written nomination.\nAll nominees must consent to their nomination. This can either be provided to the Secretary directly or on the floor of the AGM. If a nominee has not consented to their nomination at the time of the nomination their nomination will be null and void.\n\nAll nominations must be sent to secretary@subsoc.com.au and include the student\xe2\x80\x99s full name, preferred name, Access Card Number, Degree and year of Degree. Any nominations not submitted with this information will be returned to request the correct information.\n\nAll nominations will be passed on to the Returning Officer by the secretary regardless of their validity. The ultimate decision on whether a nomination is to be accepted is at the discretion of the Returning Officer. However, the secretary may provide their own personal advice as to whether a nomination will be accepted and will pass that advice on to the Returning Officer on the night of the election.'",b'SUBS Annual General Meeting',event,https://www.facebook.com/events/111492085864359/,2015-07-30 04:12:59,1,0,0
124462251040725_528418557311757,"b'Notice is hereby given for the 2015 Sydney University Business School AGM to be held on the 17/8/2015 at 1800 AEST at the Isabel Fidler Room, Level 2, Manning House.\n\nThe agenda for the Annual General Meeting shall include:\n\n1. Opening and welcome\n2. Apologies and leaves of absence\n3. Minutes of the previous meeting\n4. Business arising from the minutes\n5. Correspondence\n6. Motions on notice\n7. Annual Reports\n7.1 President\n7.2 Treasurer\n7.3 Secretary\n7.4 Other Executive Members\n8. Election of the Executive\n9. General business\n\nPlease also consider this notice for the election of all positions aside for the first year representative as per the constitution. Nominations are officially open and will close on the 16.8.15 at 1800 AEST sharp. No nominations will be accepted after this time.\n\nThe positions available are:\n\ni) 1 President\nii) 1 Vice President\niii) 1 Secretary\niv) 1 Treasurer \nv) 3 Events Directors\nvi) 1 External Relations Director\nvii) 1 Marketing Director (Social Media)\nviii) 1 Marketing Director (Design)\nix) 3 Publications Directors\nx) 2 Sports Directors\nxi) 2 IT Directors\nxii) 1 Alumni Relations Director\n\nAll nominees are invited to submit a short paragraph to be read on their behalf if they are unable to attend the meeting in person. As per the constitution any person nominating for the position of President, Vice President, Secretary and Treasurer must submit a written nomination. The president must also have previously served on a business school affiliated society executive. Please ensure this is included in your written nomination.\n\nAll nominees must consent to their nomination. This can either be provided to the Secretary directly or on the floor of the AGM. If a nominee has not consented to their nomination at the time of the nomination their nomination will be null and void.\n\nAll nominations must be sent to secretary@subsoc.com.au and include the student\xe2\x80\x99s full name, preferred name, Access Card Number, Degree and year of Degree. Any nominations not submitted with this information will be returned to request the correct information.\n\nAll nominations will be passed on to the Returning Officer by the secretary regardless of their validity. The ultimate decision on whether a nomination is to be accepted is at the discretion of the Returning Officer. However, the secretary may provide their own personal advice as to whether a nomination will be accepted and will pass that advice on to the Returning Officer on the night of the election.'",,status,,2015-07-28 03:30:18,2,0,3
124462251040725_527930907360522,"b""Hey all!!\n\nWe have officially just got in the first batch of our Limited Hoodies and Sweatshirts #SYDNEYBUSINESS. \n\nThis has never been done before and if you don't want to miss out on a one time offer, buy out before you miss out!\n\nWe are selling both Sweats and Hoodies for $25.52 via the link below!! \n\nhttps://subsevents.iwannaticket.com.au/event/subs-hoodies-sweatshirts-OTUxMQ\n\nTo pick up your limited edition hoddies and sweats - we will have a few days you can pick it up. - dates TBA , however if you need to pick up ASAP. please message the page. \n\nSUBS""",b'Timeline Photos',photo,https://www.facebook.com/SydneyUniversityBusinessSociety/photos/a.166658686821081.1073741825.124462251040725/527930907360522/?type=3,2015-07-26 21:59:10,12,3,1
124462251040725_577867412352829,"b""Comrades. Enough is enough. Let's go to war.\n\n*************************************\n\nWhen: 13th of August \nWhere: El Topo Basement Bondi Junction \nTickets: $15 for access $20 for non access\n\nhttps://subsevents.iwannaticket.com.au/event/subs-back-to-semester-party-OTQ4MA\n\n*************************************\n\nLadies and gentlemen of business schools and other faculties around NSW (yes, tonight we'll let it slide and accept you as one of us). As the dark cloud, better known as Semester 2 looms and begins to cast its shadow, we at SUBS feel that something must be done. \n\nSo, in heroic business student fashion, we have decided to take ownership of this \nabhorrent responsibility. Let us take action and rise above this ominous fog that is Semester 2. Let us get ridiculously turned up. Let us rebel against the system and prove that we can and will party like the future CEOs.\n\nWhat is expected:\n\n- LOTS of camo and other military themed outfits. Dress up people. Now is not the time to be afraid. Embrace the camo. \n\n- 'Sun's out, gun's out' is a policy that we're going to have to enforce--sorry. It may be winter, and it will be night time, but all you bronzed beauties that have just arrived back from Europe and successfully teased us Sydneysiders with your 24-7 Insta updates, it's time to take one for the team. We don't care if it's 10C. Guns out people, guns out. \n\n- Shots shall be fired all night long. Just as Lionel Richie always intended.\n\nhttps://subsevents.iwannaticket.com.au/event/subs-back-to-semester-party-OTQ4MA\n\nSUBS supports the responsible drinking of alcohol.""",b'SUBS Presents: Back to Semester Party',event,https://www.facebook.com/events/577867412352829/,2015-07-21 02:56:10,3,0,0
124462251040725_525387040948242,b'Commbank Graduate and Summer Intern Programs are closing soon. Hurry!\n\ncommbank.com.au/graduate',b'Timeline Photos',photo,https://www.facebook.com/SydneyUniversityBusinessSociety/photos/a.166658686821081.1073741825.124462251040725/525387040948242/?type=3,2015-07-21 02:42:44,1,0,0
124462251040725_521045338049079,"b""Get keen everyone! Intervarsity kicks off at 9am tomorrow morning so please turn up on time for your games. \n\nhttps://www.facebook.com/events/870956722958236/\n\nEven if you aren't playing, come along and support your mates as they duke it out for 2015 Intervarsity Sports Cup and then head over to Hugos Lounge at night for the after party. The theme is university colours so don't forget to dress up!\n\nIntervarsity Uni Colours Party: https://www.facebook.com/events/599482616820975/""","b'USYD, UNSW and UTS Business Societies Present: Intervarsity Sports Cup 2015!'",event,https://www.facebook.com/events/870956722958236/,2015-07-09 18:23:27,0,0,0
124462251040725_514761305344149,"b'ATTENTION ALL BUSINESS STUDENTS\n\n                   INTER-VARSITY SPORTS CUP!\n\nHope you all have almost got through your exams in one piece.\n\nThe time has arrived! The rivalry is electrifying! We are so proud and so excited to announce that the 2015 Inter-varsity Sports Cup is finally here! July 11th \xe2\x80\x93 mark the date!  The event will be held at Sydney Boys High School.\n\n--------------WHAT IS IT---------------\n3 sports. 3 unis. Touch. Futsal. Basketball. USYD. UNSW. UTS. The 2015 Winner\xe2\x80\x99s Cup! The bragging rights!! The prize money!!!\n\n-------------HOW TO ENTER----------\nContact the following execs Trev Yiu (Touch), Joel Leu (Basketball) and Dane Bogaardt (Futsal) if you want to play and they will tell you about registrations accordingly. Places are strictly limited, 10 players per team per sport. Teams are chosen first come first served, with prior sports experience taken into account. (Psst! The teams are mixed and girls will be winning their team x2 for every point they score)\n\nIf you are thinking of joining a team with mates from a different uni, that\xe2\x80\x99s absolutely okay with us! Just make sure to register as repping USYD once they have clearance from the specific representative.\n\nN O T E: Please do not register and pay without speaking to one of the execs.  If successful, you will be given the link to register.\n\n-------------WHAT ELSE------------\nPizza will be provided throughout the day too and if that doesn\xe2\x80\x99t convince you to come, then you definitely need to come! And bring all your mates!\n\n-------------BUT THEN???-------------\nAfter USYD has won the cup and our teams have won their big bucks, everybody head down to the Inter-varsity Uni Colours Party 2015 for even more hectic times! https://www.facebook.com/events/599482616820975/ We are also proud to present K.E.G., USYD\xe2\x80\x99s favourite resident DJ, whom you might remember from SUBS Camp, Business Ball and Cruise! So come down and show some love and pride!\n\nWe look forward to seeing you all there! \xe2\x98\xba'","b'UTS, USYD & UNSW Bsoc Presents: Inter-varsity Uni Colours Party 2015'",event,https://www.facebook.com/events/599482616820975/,2015-06-25 05:25:19,1,0,0
